Serial No.,Question,Answer,Difficulty
138,নগরায়নের নেতিবাচক প্রভাব কমাতে' দুটি উপায় উল্লেখ করুন।,"নগরায়নের নেতিবাচক প্রভাব কমাতে' দুটি উপায় হলো - ১. পরিকল্পিত নগর উন্নয়ন ও সবুজ স্থানের সৃষ্টি, ২. গণপরিবহন ব্যবস্থার উন্নয়ন ও বর্জ্য ব্যবস্থাপনা।",Hard
139,আইনস্টাইনের আপেক্ষিকতা তত্ত্ব' (Theory of Relativity) কী এবং এর দুটি অংশ উল্লেখ করুন।,"আইনস্টাইনের আপেক্ষিকতা তত্ত্ব' হলো স্থান ও কাল এবং মহাকর্ষের ধারণা সংক্রান্ত পদার্থবিজ্ঞানের একটি বিপ্লবী তত্ত্ব। এর দুটি অংশ হলো - ১. বিশেষ আপেক্ষিকতা তত্ত্ব (Special Relativity), এবং ২. সাধারণ আপেক্ষিকতা তত্ত্ব (General Relativity)।",Hard
140,কিয়োটো প্রোটোকল' (Kyoto Protocol) কী ছিল এবং এর প্রধান লক্ষ্য কী?,কিয়োটো প্রোটোকল' হলো ১৯৯৭ সালে স্বাক্ষরিত একটি আন্তর্জাতিক চুক্তি যা গ্রীনহাউস গ্যাস নির্গমন কমানোর লক্ষ্যে কাজ করে। এর প্রধান লক্ষ্য ছিল শিল্পোন্নত দেশগুলোর গ্রীনহাউস গ্যাস নির্গমন কমানোর জন্য আইনগতভাবে বাধ্যবাধকতা আরোপ করা।,Hard
141,প্যান-আফ্রিকানিজম' (Pan-Africanism) বলতে কী বোঝায়?,প্যান-আফ্রিকানিজম' হলো একটি রাজনৈতিক ও সাংস্কৃতিক আন্দোলন যা আফ্রিকার মহাদেশ ও আফ্রিকান বংশোদ্ভূতদের মধ্যে ঐক্য ও সংহতি গড়ে তোলার উপর জোর দেয়।,Hard
142,সামাজিক চুক্তি তত্ত্ব' (Social Contract Theory) এর মূল কথা কী?,"সামাজিক চুক্তি তত্ত্ব' হলো একটি রাজনৈতিক দর্শন যা ব্যাখ্যা করে যে, ব্যক্তিরা তাদের অধিকারের কিছু অংশ ছেড়ে দিয়ে একটি সমাজে বাস করতে এবং একটি সরকার গঠন করতে সম্মত হয়, যাতে তারা সুরক্ষা ও স্থিতিশীলতা লাভ করতে পারে।",Hard
143,গ্লোবাল ভিলেজ' (Global Village) ধারণাটি কে প্রবর্তন করেন এবং এর মূল বক্তব্য কী?,"গ্লোবাল ভিলেজ' ধারণাটি মার্শাল ম্যাকলুহান প্রবর্তন করেন। এর মূল বক্তব্য হলো, ইলেকট্রনিক যোগাযোগ মাধ্যমের উন্নতির ফলে বিশ্ব একটি ছোট গ্রামে পরিণত হয়েছে, যেখানে তথ্য দ্রুত ছড়িয়ে পড়ে এবং বিশ্বের মানুষ একে অপরের সাথে সংযুক্ত থাকে।",Hard
144,রেইনবো ওয়ারিয়র্স' (Rainbow Warriors) কোন সংগঠনের জাহাজ এবং এর উদ্দেশ্য কী?,রেইনবো ওয়ারিয়র্স' হলো গ্রিনপিস (Greenpeace) নামক পরিবেশবাদী সংগঠনের জাহাজ। এর উদ্দেশ্য হলো পরিবেশগত অবক্ষয় এবং পারমাণবিক পরীক্ষার বিরুদ্ধে প্রতিবাদ করা।,Hard
145,সিলিকন ভ্যালি' (Silicon Valley) কোথায় অবস্থিত এবং এটি কেন বিখ্যাত?,"সিলিকন ভ্যালি' যুক্তরাষ্ট্রের ক্যালিফোর্নিয়া রাজ্যে অবস্থিত। এটি বিশ্বব্যাপী প্রযুক্তি উদ্ভাবন, বিশেষ করে কম্পিউটার হার্ডওয়্যার, সফটওয়্যার এবং ইন্টারনেট শিল্পের জন্য বিখ্যাত।",Hard
146,জাতিসংঘের নিরাপত্তা পরিষদের ভেটো ক্ষমতা' বলতে কী বোঝায়?,"জাতিসংঘের নিরাপত্তা পরিষদের ভেটো ক্ষমতা' বলতে স্থায়ী সদস্য দেশগুলোর (চীন, ফ্রান্স, রাশিয়া, যুক্তরাজ্য, যুক্তরাষ্ট্র) সেই ক্ষমতাকে বোঝায়, যার মাধ্যমে তারা কোনো প্রস্তাবের বিরুদ্ধে ভোট দিয়ে সেটিকে বাতিল করে দিতে পারে, যদিও অন্য সকল সদস্য পক্ষে ভোট দেয়।",Hard
147,তৃতীয় বিশ্বের দেশগুলো' বলতে কী বোঝায় এবং এই শব্দটি কেন বিতর্কিত?,"তৃতীয় বিশ্বের দেশগুলো' শব্দটি সাধারণত উন্নয়নশীল বা স্বল্পোন্নত দেশগুলোকে বোঝাতে ব্যবহৃত হতো, যারা স্নায়ুযুদ্ধে কোনো ব্লকের অন্তর্ভুক্ত ছিল না। এটি বিতর্কিত কারণ এটি দেশগুলোকে তাদের অর্থনৈতিক অবস্থার ভিত্তিতে অসমভাবে শ্রেণীবদ্ধ করে এবং একটি পুরনো ভূ-রাজনৈতিক প্রেক্ষাপট থেকে উদ্ভূত।",Hard
148,সার্বিক মানবাধিকার ঘোষণা' (Universal Declaration of Human Rights) কবে গৃহীত হয় এবং এর গুরুত্ব কী?,সার্বিক মানবাধিকার ঘোষণা' ১৯৪৮ সালের ১০ই ডিসেম্বর জাতিসংঘ কর্তৃক গৃহীত হয়। এর গুরুত্ব হলো এটি বিশ্বের সকল মানুষের মৌলিক অধিকার ও স্বাধীনতার একটি আন্তর্জাতিক মানদণ্ড স্থাপন করেছে।,Hard
149,বৈশ্বিক উষ্ণায়ন' (Global Warming) মোকাবেলায় দুটি আন্তর্জাতিক প্রচেষ্টার নাম উল্লেখ করুন।,"বৈশ্বিক উষ্ণায়ন' মোকাবেলায় দুটি আন্তর্জাতিক প্রচেষ্টা হলো - ১. প্যারিস চুক্তি (Paris Agreement), এবং ২. কিয়োটো প্রোটোকল (Kyoto Protocol)।",Hard
149,বাংলাদেশের রাজধানীর নাম কী?,বাংলাদেশের রাজধানীর নাম ঢাকা।,Easy