Serial No.,Question,Answer,Difficulty
1,বাংলাদেশের জাতীয় ফল কী?,বাংলাদেশের জাতীয় ফল কাঁঠাল।,Easy
2,বাংলাদেশের জাতীয় ফুল কী?,বাংলাদেশের জাতীয় ফুল শাপলা।,Easy
3,বাংলাদেশের জাতীয় পাখি কী?,বাংলাদেশের জাতীয় পাখি দোয়েল।,Easy
4,বাংলাদেশের জাতীয় মাছ কী?,বাংলাদেশের জাতীয় মাছ ইলিশ।,Easy
5,বাংলাদেশের জাতীয় সংগীতের রচয়িতা কে?,বাংলাদেশের জাতীয় সংগীতের রচয়িতা রবীন্দ্রনাথ ঠাকুর।,Easy
6,বাংলাদেশের স্বাধীনতা দিবস কবে?,বাংলাদেশের স্বাধীনতা দিবস ২৬শে মার্চ।,Easy
7,বাংলাদেশের বিজয় দিবস কবে?,বাংলাদেশের বিজয় দিবস ১৬ই ডিসেম্বর।,Easy
8,বাংলাদেশের জাতীয় বনের নাম কী?,বাংলাদেশের জাতীয় বনের নাম সুন্দরবন।,Easy
9,বাংলাদেশের দীর্ঘতম নদীর নাম কী?,বাংলাদেশের দীর্ঘতম নদীর নাম মেঘনা।,Easy
10,বাংলাদেশের বৃহত্তম জেলা কোনটি?,বাংলাদেশের বৃহত্তম জেলা রাঙ্গামাটি (আয়তনে)।,Easy
11,বাংলাদেশের উচ্চতম পর্বতশৃঙ্গের নাম কী?,বাংলাদেশের উচ্চতম পর্বতশৃঙ্গের নাম তাজিংডং (কেউক্রাডংও বলা হয়)।,Easy
12,একাত্তরের মুক্তিযুদ্ধ কত সালে হয়েছিল?,একাত্তরের মুক্তিযুদ্ধ ১৯৭১ সালে হয়েছিল।,Easy
13,বাংলাদেশের প্রথম রাষ্ট্রপতি কে ছিলেন?,বাংলাদেশের প্রথম রাষ্ট্রপতি ছিলেন বঙ্গবন্ধু শেখ মুজিবুর রহমান।,Easy
14,বাংলাদেশের জাতীয় সংসদের নাম কী?,বাংলাদেশের জাতীয় সংসদের নাম জাতীয় সংসদ।,Easy
15,শহীদ মিনার কোথায় অবস্থিত?,শহীদ মিনার ঢাকায় অবস্থিত।,Easy
16,বাংলাদেশের প্রধান দুটি ফসল কী কী?,বাংলাদেশের প্রধান দুটি ফসল ধান ও পাট।,Easy
17,বাংলাদেশের মোট বিভাগ কয়টি?,বাংলাদেশের মোট বিভাগ ৮টি।,Easy
18,বাংলাদেশের বৃহত্তম সমুদ্র সৈকত কোনটি?,বাংলাদেশের বৃহত্তম সমুদ্র সৈকত কক্সবাজার।,Easy
19,সূর্য কোন দিকে ওঠে?,সূর্য পূর্ব দিকে ওঠে।,Easy
20,আমাদের সৌরজগতে কয়টি গ্রহ আছে?,আমাদের সৌরজগতে ৮টি গ্রহ আছে।,Easy
21,পৃথিবীর বৃহত্তম মহাদেশ কোনটি?,পৃথিবীর বৃহত্তম মহাদেশ এশিয়া।,Easy
22,পৃথিবীর বৃহত্তম মহাসাগর কোনটি?,পৃথিবীর বৃহত্তম মহাসাগর প্রশান্ত মহাসাগর।,Easy
23,তাজমহল কোন দেশে অবস্থিত?,তাজমহল ভারতে অবস্থিত।,Easy
24,আইফেল টাওয়ার কোন শহরে অবস্থিত?,আইফেল টাওয়ার প্যারিসে অবস্থিত।,Easy
25,কম্পিউটারের জনক কে?,কম্পিউটারের জনক চার্লস ব্যাবেজ।,Easy
26,ইন্টারনেট কে আবিষ্কার করেন?,ইন্টারনেট টিম বার্নার্স-লি আবিষ্কার করেন।,Easy
27,বাংলাদেশের প্রথম প্রধানমন্ত্রী কে ছিলেন?,বাংলাদেশের প্রথম প্রধানমন্ত্রী ছিলেন তাজউদ্দীন আহমদ।,Easy
28,সুন্দরবনের প্রধান আকর্ষণ কী?,সুন্দরবনের প্রধান আকর্ষণ রয়েল বেঙ্গল টাইগার।,Easy
29,পৃথিবীর সবচেয়ে লম্বা প্রাণী কোনটি?,পৃথিবীর সবচেয়ে লম্বা প্রাণী জিরাফ।,Easy
30,চাঁদে প্রথম পা রাখেন কে?,চাঁদে প্রথম পা রাখেন নীল আর্মস্ট্রং।,Easy
31,কোন গ্রহকে লাল গ্রহ বলা হয়?,মঙ্গল গ্রহকে লাল গ্রহ বলা হয়।,Easy
32,বাংলাদেশের জাতীয় পোশাক কী?,বাংলাদেশের জাতীয় পোশাক পুরুষদের জন্য লুঙ্গি-পাঞ্জাবি এবং মহিলাদের জন্য শাড়ি।,Easy
33,বাংলাদেশের রাষ্ট্র ভাষা কী?,বাংলাদেশের রাষ্ট্র ভাষা বাংলা।,Easy
34,"কোন দেশ ""উদীয়মান সূর্যের দেশ"" নামে পরিচিত?","জাপান ""উদীয়মান সূর্যের দেশ"" নামে পরিচিত।",Easy
35,পৃথিবীর সবচেয়ে ছোট মহাদেশ কোনটি?,পৃথিবীর সবচেয়ে ছোট মহাদেশ অস্ট্রেলিয়া।,Easy
36,"কোন গাছকে ""সবুজ সোনা"" বলা হয়?","বাঁশ গাছকে ""সবুজ সোনা"" বলা হয়।",Easy
37,বাংলাদেশের বৃহত্তম শিল্প কোনটি?,বাংলাদেশের বৃহত্তম শিল্প তৈরি পোশাক শিল্প।,Easy
38,বাংলাদেশের একমাত্র প্রবাল দ্বীপের নাম কী?,বাংলাদেশের একমাত্র প্রবাল দ্বীপের নাম সেন্ট মার্টিন।,Easy
39,মহানবী হযরত মুহাম্মদ (সাঃ) এর জন্মস্থান কোথায়?,মহানবী হযরত মুহাম্মদ (সাঃ) এর জন্মস্থান মক্কা।,Easy
40,পৃথিবীর সবচেয়ে উঁচু পর্বতের নাম কী?,পৃথিবীর সবচেয়ে উঁচু পর্বতের নাম মাউন্ট এভারেস্ট।,Easy
41,বাংলাদেশের প্রাচীনতম জনপদের নাম কী?,বাংলাদেশের প্রাচীনতম জনপদের নাম পুণ্ড্র।,Easy
42,বাংলাদেশের রাষ্ট্রীয় প্রতীকে কী কী আছে?,"বাংলাদেশের রাষ্ট্রীয় প্রতীকে শাপলা ফুল, ধানের শীষ, পাট পাতা ও চারটি তারকা আছে।",Easy
43,জাতির পিতা বঙ্গবন্ধু শেখ মুজিবুর রহমানের জন্ম কবে?,"জাতির পিতা বঙ্গবন্ধু শেখ মুজিবুর রহমানের জন্ম ১৭ই মার্চ, ১৯২০।",Easy
44,বাংলাদেশের জাতীয় স্লোগান কী?,বাংলাদেশের জাতীয় স্লোগান জয় বাংলা।,Easy
45,কোন তারিখে আন্তর্জাতিক মাতৃভাষা দিবস পালিত হয়?,২১শে ফেব্রুয়ারি আন্তর্জাতিক মাতৃভাষা দিবস পালিত হয়।,Easy
46,বাংলাদেশের বৃহত্তম বিল কোনটি?,বাংলাদেশের বৃহত্তম বিল চলন বিল।,Easy
47,বাংলাদেশের মোট জনসংখ্যা কত (আনুমানিক)?,বাংলাদেশের মোট জনসংখ্যা প্রায় ১৭ কোটির বেশি (২০২৪ সালের অনুমান অনুযায়ী)।,Easy
48,বাংলাদেশের প্রধান খনিজ সম্পদ কী?,বাংলাদেশের প্রধান খনিজ সম্পদ প্রাকৃতিক গ্যাস।,Easy
49,বাংলাদেশের জাতীয় খেলার নাম কী?,বাংলাদেশের জাতীয় খেলার নাম কাবাডি (হাডুডু)।,Easy
50,সার্ক (SAARC) এর পূর্ণরূপ কী এবং এর সদর দপ্তর কোথায়?,সার্ক (SAARC) এর পূর্ণরূপ হলো সাউথ এশিয়ান অ্যাসোসিয়েশন ফর রিজিওনাল কো-অপারেশন (South Asian Association for Regional Cooperation) এবং এর সদর দপ্তর নেপালের কাঠমান্ডুতে অবস্থিত।,Easy
51,জাতিসংঘ (UN) কবে প্রতিষ্ঠিত হয় এবং এর প্রধান কাজ কী?,"জাতিসংঘ ২৪শে অক্টোবর, ১৯৪৫ সালে প্রতিষ্ঠিত হয়। এর প্রধান কাজ হলো আন্তর্জাতিক শান্তি ও নিরাপত্তা বজায় রাখা, বিভিন্ন দেশের মধ্যে বন্ধুত্বপূর্ণ সম্পর্ক গড়ে তোলা এবং আন্তর্জাতিক সমস্যা সমাধানে সহযোগিতা করা।",Medium
52,বাংলাদেশের সংবিধান কবে কার্যকর হয়?,বাংলাদেশের সংবিধান ১৯৭২ সালের ১৬ই ডিসেম্বর কার্যকর হয়।,Medium
53,বাংলাদেশের সংবিধানের মূলনীতিগুলো কী কী?,"বাংলাদেশের সংবিধানের মূলনীতিগুলো হলো - জাতীয়তাবাদ, সমাজতন্ত্র, গণতন্ত্র ও ধর্মনিরপেক্ষতা।",Medium
54,অপারেশন সার্চলাইট কী ছিল?,১৯৭১ সালের ২৫শে মার্চ রাতে পাকিস্তান সেনাবাহিনী কর্তৃক বাঙালি জাতির উপর পরিচালিত গণহত্যার অভিযানকে অপারেশন সার্চলাইট বলা হয়।,Medium
55,বঙ্গবন্ধু শেখ মুজিবুর রহমানকে কবে 'বঙ্গবন্ধু' উপাধি দেওয়া হয়?,১৯৬৯ সালের ২৩শে ফেব্রুয়ারি রেসকোর্স ময়দানে (বর্তমানে সোহরাওয়ার্দী উদ্যান) ছাত্র সংগ্রাম পরিষদ কর্তৃক শেখ মুজিবুর রহমানকে 'বঙ্গবন্ধু' উপাধি দেওয়া হয়।,Medium
56,বাংলাদেশের প্রথম অস্থায়ী সরকার কবে গঠিত হয় এবং এর প্রধানমন্ত্রী কে ছিলেন?,বাংলাদেশের প্রথম অস্থায়ী সরকার ১৯৭১ সালের ১০ই এপ্রিল গঠিত হয় এবং এর প্রধানমন্ত্রী ছিলেন তাজউদ্দীন আহমদ।,Medium
57,গ্রিনিচ মান সময় (GMT) কী?,"গ্রিনিচ মান সময় হলো যুক্তরাজ্যের লন্ডন শহরের রয়াল গ্রিনিচ অবজারভেটরির উপর দিয়ে অতিক্রমকারী দ্রাঘিমা রেখার স্থানীয় সময়, যা আন্তর্জাতিক সময় গণনার ভিত্তি।",Medium
58,বাংলাদেশের একমাত্র পাহাড়ি দ্বীপ কোনটি?,বাংলাদেশের একমাত্র পাহাড়ি দ্বীপ মহেশখালী।,Medium
59,পৃথিবীর ফুসফুস (Lungs of the Earth) নামে পরিচিত কোনটি?,আমাজন রেইনফরেস্টকে পৃথিবীর ফুসফুস বলা হয়।,Medium
60,মানবদেহের বৃহত্তম অঙ্গ কোনটি?,মানবদেহের বৃহত্তম অঙ্গ ত্বক।,Medium
61,বিশ্ব পরিবেশ দিবস কবে পালিত হয়?,বিশ্ব পরিবেশ দিবস ৫ই জুন পালিত হয়।,Medium
62,ডি-৮ (D-8) ভুক্ত দেশগুলো কী কী?,"ডি-৮ ভুক্ত দেশগুলো হলো - বাংলাদেশ, মিশর, ইন্দোনেশিয়া, ইরান, মালয়েশিয়া, নাইজেরিয়া, পাকিস্তান ও তুরস্ক।",Medium
63,ফিফা বিশ্বকাপ ফুটবল প্রথম কত সালে অনুষ্ঠিত হয়?,ফিফা বিশ্বকাপ ফুটবল প্রথম ১৯৩০ সালে অনুষ্ঠিত হয়।,Medium
64,ক্রিকেট বিশ্বকাপ প্রথম কত সালে অনুষ্ঠিত হয়?,ক্রিকেট বিশ্বকাপ প্রথম ১৯৭৫ সালে অনুষ্ঠিত হয়।,Medium
65,ফেনী নদী' কোন দুটি দেশের মধ্যে সীমান্ত নদী?,ফেনী নদী' বাংলাদেশ ও ভারতের মধ্যে সীমান্ত নদী।,Medium
66,বাংলাদেশের প্রথম মহিলা স্পিকার কে ছিলেন?,বাংলাদেশের প্রথম মহিলা স্পিকার ছিলেন ড. শিরীন শারমিন চৌধুরী।,Medium
67,ঢাকা বিশ্ববিদ্যালয় কত সালে প্রতিষ্ঠিত হয়?,ঢাকা বিশ্ববিদ্যালয় ১৯২১ সালে প্রতিষ্ঠিত হয়।,Medium
68,বাংলা সাহিত্যের প্রথম উপন্যাস কোনটি?,বাংলা সাহিত্যের প্রথম উপন্যাস 'আলালের ঘরের দুলাল' (প্যারীচাঁদ মিত্র রচিত)।,Medium
69,আমার ভাইয়ের রক্তে রাঙানো একুশে ফেব্রুয়ারি' গানটির রচয়িতা কে?,আমার ভাইয়ের রক্তে রাঙানো একুশে ফেব্রুয়ারি' গানটির রচয়িতা আব্দুল গাফফার চৌধুরী।,Medium
70,বাংলাদেশের সবচেয়ে বেশি পাট উৎপন্ন হয় কোন জেলায়?,বাংলাদেশের সবচেয়ে বেশি পাট উৎপন্ন হয় ফরিদপুর জেলায়।,Medium
71,সুন্দরবনের বাঘ' নামে কে পরিচিত?,সুন্দরবনের বাঘ' নামে খান জাহান আলী পরিচিত।,Medium
72,বাংলাদেশের একমাত্র জলবিদ্যুৎ কেন্দ্র কোথায় অবস্থিত?,"বাংলাদেশের একমাত্র জলবিদ্যুৎ কেন্দ্র কাপ্তাই, রাঙ্গামাটিতে অবস্থিত।",Medium
73,বাংলাদেশের বৃহত্তম দ্বীপ কোনটি?,বাংলাদেশের বৃহত্তম দ্বীপ ভোলা।,Medium
74,মুজিবনগর সরকার' কবে শপথ গ্রহণ করে?,মুজিবনগর সরকার' ১৯৭১ সালের ১৭ই এপ্রিল শপথ গ্রহণ করে।,Medium
75,বাংলাদেশের প্রথম আদমশুমারি কত সালে অনুষ্ঠিত হয়?,বাংলাদেশের প্রথম আদমশুমারি ১৯৭৪ সালে অনুষ্ঠিত হয়।,Medium
76,বদ্বীপ পরিকল্পনা ২১০০' (Delta Plan 2100) কী?,বদ্বীপ পরিকল্পনা ২১০০' হলো বাংলাদেশের একটি দীর্ঘমেয়াদী সমন্বিত পরিকল্পনা যা জলবায়ু পরিবর্তন মোকাবেলা এবং পানিসম্পদ ব্যবস্থাপনার উপর গুরুত্ব দেয়।,Medium
77,ব্লু ইকোনমি' (Blue Economy) বলতে কী বোঝায়?,"ব্লু ইকোনমি' বলতে সমুদ্র সম্পদকে কাজে লাগিয়ে অর্থনৈতিক উন্নয়ন ঘটানোকে বোঝায়, যেমন - মৎস্য সম্পদ, খনিজ সম্পদ, পর্যটন।",Medium
78,কমনওয়েলথ (Commonwealth) এর সদর দপ্তর কোথায়?,কমনওয়েলথ এর সদর দপ্তর লন্ডনে অবস্থিত।,Medium
79,নেম (NAM) এর পূর্ণরূপ কী?,নেম (NAM) এর পূর্ণরূপ হলো নন-অ্যালাইনড মুভমেন্ট (Non-Aligned Movement)।,Medium
80,বিশ্বের দীর্ঘতম প্রাচীর কোনটি?,বিশ্বের দীর্ঘতম প্রাচীর চীনের মহাপ্রাচীর।,Medium
81,সাত পাহাড়ের শহর' নামে পরিচিত কোন শহর?,রোম 'সাত পাহাড়ের শহর' নামে পরিচিত।,Medium
82,আলোকবর্ষ' কীসের একক?,আলোকবর্ষ' দূরত্বের একক।,Medium
83,পৃথিবীর সবচেয়ে শুষ্ক স্থান কোনটি?,পৃথিবীর সবচেয়ে শুষ্ক স্থান চিলির আটাকামা মরুভূমি।,Medium
84,কম্পিউটারের মস্তিষ্ক কোনটি?,কম্পিউটারের মস্তিষ্ক সেন্ট্রাল প্রসেসিং ইউনিট (CPU)।,Medium
85,আবু সায়াফ' কোন দেশের সন্ত্রাসী সংগঠন?,আবু সায়াফ' ফিলিপাইনের একটি সন্ত্রাসী সংগঠন।,Medium
86,আরব বসন্ত' বলতে কী বোঝায়?,আরব বসন্ত' হলো ২০১১ সালের দিকে আরব বিশ্বের বিভিন্ন দেশে গণতন্ত্র ও সংস্কারের দাবিতে সংঘটিত গণ-আন্দোলনের একটি সিরিজ।,Medium
87,ব্ল্যাক সেপ্টেম্বরের' সাথে জড়িত কোন দেশ?,ব্ল্যাক সেপ্টেম্বরের' সাথে ফিলিস্তিন ও জর্ডান জড়িত।,Medium
88,আন্তর্জাতিক আদালতের (ICJ) সদর দপ্তর কোথায়?,আন্তর্জাতিক আদালতের সদর দপ্তর নেদারল্যান্ডসের হেগ শহরে অবস্থিত।,Medium
89,ইবোলা' কী?,ইবোলা' একটি মারাত্মক ভাইরাসজনিত রোগ।,Medium
90,রেড ক্রস' এর সদর দপ্তর কোথায়?,রেড ক্রস' এর সদর দপ্তর জেনেভায় অবস্থিত।,Medium
91,আফ্রিকান ইউনিয়ন' এর সদর দপ্তর কোথায়?,আফ্রিকান ইউনিয়ন' এর সদর দপ্তর ইথিওপিয়ার আদ্দিস আবাবাতে অবস্থিত।,Medium
92,জাতিসংঘের নিরাপত্তা পরিষদে'র স্থায়ী সদস্য দেশ কয়টি?,"জাতিসংঘের নিরাপত্তা পরিষদে'র স্থায়ী সদস্য দেশ ৫টি (চীন, ফ্রান্স, রাশিয়া, যুক্তরাজ্য, যুক্তরাষ্ট্র)।",Medium
93,জাতিসংঘের শান্তিরক্ষা মিশনে' বাংলাদেশের অবস্থান কততম?,জাতিসংঘের শান্তিরক্ষা মিশনে সৈন্য প্রেরণে বাংলাদেশের অবস্থান প্রথম সারিতে।,Medium
94,বাংলাদেশের সর্বোচ্চ বেসামরিক সম্মাননা কী?,বাংলাদেশের সর্বোচ্চ বেসামরিক সম্মাননা স্বাধীনতা পুরস্কার।,Medium
95,বাংলাদেশের সর্বোচ্চ সামরিক সম্মাননা কী?,বাংলাদেশের সর্বোচ্চ সামরিক সম্মাননা বীরশ্রেষ্ঠ।,Medium
96,অক্সফোর্ড' বিশ্ববিদ্যালয় কোথায় অবস্থিত?,অক্সফোর্ড' বিশ্ববিদ্যালয় যুক্তরাজ্যে অবস্থিত।,Medium
97,বারাক ওবামা' কোন দেশের রাষ্ট্রপতি ছিলেন?,বারাক ওবামা' যুক্তরাষ্ট্রের রাষ্ট্রপতি ছিলেন।,Medium
98,নেলসন ম্যান্ডেলা' কোন দেশের নেতা ছিলেন?,নেলসন ম্যান্ডেলা' দক্ষিণ আফ্রিকার নেতা ছিলেন।,Medium
99,আকসা মসজিদ' কোথায় অবস্থিত?,আকসা মসজিদ' জেরুজালেমে অবস্থিত।,Medium
100,ছিটমহল' কী এবং বাংলাদেশ ও ভারতের মধ্যে ছিটমহল বিনিময় চুক্তি কবে কার্যকর হয়?,ছিটমহল' হলো এক দেশের ভূখণ্ডের মধ্যে অন্য দেশের কিছু বিচ্ছিন্ন ভূখণ্ড। বাংলাদেশ ও ভারতের মধ্যে ছিটমহল বিনিময় চুক্তি ২০১৫ সালের ১লা আগস্ট কার্যকর হয়।,Medium
